Nombre,Ubicacion,Coordenadas,Capacidad
Estadio Ras Abu Aboud, Doha,25°16′49″N 51°31′21″E, 48.000 espectadores
Estadio Al Thumama, Doha,25°16′49″N 51°31′21″E, 40.000 espectadores
Estadio Internacional Khalifa, Rayán,25°15′49″N 51°26′53″E, 50.000 espectadores
Estadio Education City, Rayán,25°16′49″N 51°31′21″E, 45.350 espectadores
Estadio Al Bayt, Jor,25°39′08″N 51°29′16″E, 60.000 espectadores
Estadio Al Janoub, Al Wakrah,25°10′49″N 51°35′47″E, 40.000 espectadores
Estadio Lusail, Lusail,25°25′15″N 51°29′25″E, 94.500 espectadores
Estadio Al Rayyán, Rayán,25°19′50″N 51°20′29″E, 44.629 espectadores
